{
  "allow_live_automation": true,
  "completed_at": "2026-02-24T17:59:03Z",
  "counts": {
    "artifacts_generated": 1,
    "artifacts_skipped": 0,
    "artifacts_written": 1,
    "blocked_by_policy": 0,
    "failed": 0,
    "items_collected": 5,
    "items_scored": 5,
    "seeds_added": 2,
    "topics_selected": 1,
    "work_claimed": 2,
    "work_promoted": 2
  },
  "merlin_mode": "local",
  "paths": {
    "knowledge_root": "/mnt/c/Dev library/AaroneousAutomationSuite/Merlin/artifacts/discovery_contract/knowledge",
    "output_root": "/mnt/c/Dev library/AaroneousAutomationSuite/Merlin/artifacts/discovery_contract",
    "queue_root": "/mnt/c/Dev library/AaroneousAutomationSuite/Merlin/artifacts/discovery_contract/queue",
    "run_dir": "/mnt/c/Dev library/AaroneousAutomationSuite/Merlin/artifacts/discovery_contract/runs/run_20260224T175903Z_25bc041d"
  },
  "plan": [
    {
      "action": "CREATE",
      "artifact_id": "artifact_6749340f418c1689",
      "path": "knowledge/research/2026/02/24/offline-first-discovery-orchestration-for-plugin-ecosystems.md",
      "valid": true
    }
  ],
  "policy": {
    "allow_live_automation": true,
    "collector_decisions": {
      "github_search": {
        "decision": "blocked",
        "reason": "network collectors are disabled in public profile"
      },
      "github_trending": {
        "decision": "blocked",
        "reason": "network collectors are disabled in public profile"
      },
      "google_trends": {
        "decision": "blocked",
        "reason": "network collectors are disabled in public profile"
      },
      "local_cache": {
        "decision": "allowed",
        "reason": "offline collector enabled"
      },
      "local_fixture": {
        "decision": "allowed",
        "reason": "offline collector enabled"
      },
      "rss": {
        "decision": "blocked",
        "reason": "network collectors are disabled in public profile"
      }
    },
    "dry_run": false,
    "no_write": false,
    "profile": "public",
    "publisher_decisions": {
      "git": {
        "decision": "blocked",
        "reason": "live publisher is disabled in public profile"
      },
      "pr": {
        "decision": "blocked",
        "reason": "live publisher is disabled in public profile"
      },
      "stage_only": {
        "decision": "allowed",
        "reason": "stage-only publisher is always available"
      }
    }
  },
  "profile": "public",
  "publish_result": {
    "blocked_by_policy": false,
    "created_paths": [
      "knowledge/research/2026/02/24/offline-first-discovery-orchestration-for-plugin-ecosystems.md"
    ],
    "decision": "allowed",
    "message": "artifacts staged in working tree",
    "publisher_mode": "stage_only",
    "run_id": "run_20260224T175903Z_25bc041d",
    "schema_name": "AAS.Discovery.PublishResult",
    "schema_version": "1.0.0",
    "status": "staged"
  },
  "run_id": "run_20260224T175903Z_25bc041d",
  "schema_name": "AAS.Discovery.RunReport",
  "schema_version": "1.0.0",
  "started_at": "2026-02-24T17:59:03Z",
  "status": "ok"
}
